{
  "schemaVersion": 1,
  "artifactType": "stored-preferences",
  "runId": "20260607-214329",
  "userId": "alex-i9-test",
  "corpusId": "realistic",
  "storageInput": {
    "ingestionMode": "known-schema-document-ingestion",
    "statusesScored": [
      "ACTIVE"
    ],
    "suggestionsWereAutoApplied": true
  },
  "preferences": [
    {
      "id": "099b54d9-d67d-4e75-94f5-6081def0f75d",
      "userId": "125c96a5-6b68-431a-8d63-8fa296d7cc7b",
      "locationId": null,
      "slug": "communication.preferred_channels",
      "definitionId": "8dd83842-849d-4cd1-b0cc-ac165be26925",
      "value": [
        "email",
        "BILLING_ALERTS",
        "OUTAGE_NOTIFICATIONS"
      ],
      "status": "ACTIVE",
      "sourceType": "INFERRED",
      "confidence": 0.9,
      "evidence": {
        "source": "eval-ingestor-upload",
        "snippet": "\"notifications\": [\n        \"BILLING_ALERTS\",\n        \"OUTAGE_NOTIFICATIONS\"\n      ]",
        "fileName": "005-utility-account-export.txt",
        "sourceMeta": {
          "line": 34
        }
      },
      "createdAt": "2026-06-08T04:43:43.479Z",
      "updatedAt": "2026-06-08T04:43:47.312Z"
    },
    {
      "id": "97eb0638-c0f7-4d27-93b6-ffa8973218cd",
      "userId": "125c96a5-6b68-431a-8d63-8fa296d7cc7b",
      "locationId": null,
      "slug": "eval.address.current.city",
      "definitionId": "7cf1a0fd-2dfd-46a1-80d6-9892e87aeefe",
      "value": "Oakmont",
      "status": "ACTIVE",
      "sourceType": "INFERRED",
      "confidence": 0.9,
      "evidence": {
        "source": "eval-ingestor-upload",
        "snippet": "Community Management Office | 123 Main Street, Oakmont, USA",
        "fileName": "010-community-newsletter-email.txt",
        "sourceMeta": {
          "line": 48
        }
      },
      "createdAt": "2026-06-08T04:43:34.602Z",
      "updatedAt": "2026-06-08T04:44:03.938Z"
    },
    {
      "id": "4d242fa4-70d2-498d-8329-f44f2649a7ac",
      "userId": "125c96a5-6b68-431a-8d63-8fa296d7cc7b",
      "locationId": null,
      "slug": "eval.address.current.postal_code",
      "definitionId": "428a50e4-7790-4f67-b656-a1109702c999",
      "value": "97214",
      "status": "ACTIVE",
      "sourceType": "INFERRED",
      "confidence": 0.98,
      "evidence": {
        "source": "eval-ingestor-upload",
        "snippet": "PORTLAND, OR 97214",
        "fileName": "001-driver-license-upload-ocr.txt",
        "sourceMeta": {}
      },
      "createdAt": "2026-06-08T04:43:34.612Z",
      "updatedAt": "2026-06-08T04:43:34.612Z"
    },
    {
      "id": "6a733385-38b3-4a53-be36-ca46d35f07e2",
      "userId": "125c96a5-6b68-431a-8d63-8fa296d7cc7b",
      "locationId": null,
      "slug": "eval.address.current.state",
      "definitionId": "2ba42c9d-f2b6-468f-847f-c3b1477e8cb0",
      "value": "OR",
      "status": "ACTIVE",
      "sourceType": "INFERRED",
      "confidence": 0.98,
      "evidence": {
        "source": "eval-ingestor-upload",
        "snippet": "PORTLAND, OR 97214",
        "fileName": "001-driver-license-upload-ocr.txt",
        "sourceMeta": {}
      },
      "createdAt": "2026-06-08T04:43:34.607Z",
      "updatedAt": "2026-06-08T04:43:34.607Z"
    },
    {
      "id": "e11e4281-a7c7-4ed9-976d-0d29f1612905",
      "userId": "125c96a5-6b68-431a-8d63-8fa296d7cc7b",
      "locationId": null,
      "slug": "eval.address.current.street",
      "definitionId": "651fa5d0-83b6-401b-865c-08e66144d4c7",
      "value": "123 Main Street",
      "status": "ACTIVE",
      "sourceType": "INFERRED",
      "confidence": 0.9,
      "evidence": {
        "source": "eval-ingestor-upload",
        "snippet": "Community Management Office | 123 Main Street, Oakmont, USA",
        "fileName": "010-community-newsletter-email.txt",
        "sourceMeta": {
          "line": 48
        }
      },
      "createdAt": "2026-06-08T04:43:34.592Z",
      "updatedAt": "2026-06-08T04:44:03.945Z"
    },
    {
      "id": "65db60dc-59b3-44bc-a01e-ded1006bf43d",
      "userId": "125c96a5-6b68-431a-8d63-8fa296d7cc7b",
      "locationId": null,
      "slug": "eval.address.current.unit",
      "definitionId": "a4a824e3-c07a-4f18-a7e1-1110e8152cf4",
      "value": "Apt 5C",
      "status": "ACTIVE",
      "sourceType": "INFERRED",
      "confidence": 1,
      "evidence": {
        "source": "eval-ingestor-upload",
        "snippet": "Address: 7428 Evergreen Terrace, Apt 5C, Portland, OR, 97214",
        "fileName": "004-resident-portal-lease-export.md",
        "sourceMeta": {
          "line": 17
        }
      },
      "createdAt": "2026-06-08T04:43:34.597Z",
      "updatedAt": "2026-06-08T04:43:43.467Z"
    },
    {
      "id": "d7c6d7fd-06b0-46b1-923a-92bc051f9e10",
      "userId": "125c96a5-6b68-431a-8d63-8fa296d7cc7b",
      "locationId": null,
      "slug": "eval.employment.start_date",
      "definitionId": "00607c36-c275-42a9-9063-2f2819a821d3",
      "value": "2026-06-17",
      "status": "ACTIVE",
      "sourceType": "INFERRED",
      "confidence": 1,
      "evidence": {
        "source": "eval-ingestor-upload",
        "snippet": "Start Date: Wednesday, June 17, 2026",
        "fileName": "007-offer-email.md",
        "sourceMeta": {}
      },
      "createdAt": "2026-06-08T04:43:34.618Z",
      "updatedAt": "2026-06-08T04:43:56.618Z"
    },
    {
      "id": "b12647d1-8c82-4cad-8fcd-9f36e7925a72",
      "userId": "125c96a5-6b68-431a-8d63-8fa296d7cc7b",
      "locationId": null,
      "slug": "eval.employment.work_email",
      "definitionId": "0eee8be6-3321-4b30-9a27-0989d5755ade",
      "value": "alex.rivera@cascadiahiring.example.test",
      "status": "ACTIVE",
      "sourceType": "INFERRED",
      "confidence": 1,
      "evidence": {
        "source": "eval-ingestor-upload",
        "snippet": "Your work email address will be alex.rivera@cascadiahiring.example.test.",
        "fileName": "007-offer-email.md",
        "sourceMeta": {}
      },
      "createdAt": "2026-06-08T04:43:56.595Z",
      "updatedAt": "2026-06-08T04:43:56.595Z"
    },
    {
      "id": "4ab06bcd-61b7-49c1-a4e3-2d6e88990b7e",
      "userId": "125c96a5-6b68-431a-8d63-8fa296d7cc7b",
      "locationId": null,
      "slug": "eval.identity.date_of_birth",
      "definitionId": "3ef6a4aa-a7ee-4bfa-a5a6-8d331c6d25d4",
      "value": "1992-03-14",
      "status": "ACTIVE",
      "sourceType": "INFERRED",
      "confidence": 0.99,
      "evidence": {
        "source": "eval-ingestor-upload",
        "snippet": "DOB 03-14-1992",
        "fileName": "001-driver-license-upload-ocr.txt",
        "sourceMeta": {}
      },
      "createdAt": "2026-06-08T04:43:34.571Z",
      "updatedAt": "2026-06-08T04:43:34.571Z"
    },
    {
      "id": "095fca6b-4edf-430a-a23e-e5ec78965390",
      "userId": "125c96a5-6b68-431a-8d63-8fa296d7cc7b",
      "locationId": null,
      "slug": "eval.identity.middle_initial",
      "definitionId": "a264e1ee-0d6d-4533-bc3a-f965cf350bc7",
      "value": "Jordan",
      "status": "ACTIVE",
      "sourceType": "INFERRED",
      "confidence": 0.8,
      "evidence": {
        "source": "eval-ingestor-upload",
        "snippet": "Candidate Name:      Rivera, Alex Jordan",
        "fileName": "003-work-authorization-upload-receipt.txt",
        "sourceMeta": {
          "line": 14
        }
      },
      "createdAt": "2026-06-08T04:43:39.939Z",
      "updatedAt": "2026-06-08T04:43:39.939Z"
    },
    {
      "id": "18de6f2c-fc35-4e89-a07f-df77d4995cf0",
      "userId": "125c96a5-6b68-431a-8d63-8fa296d7cc7b",
      "locationId": null,
      "slug": "eval.identity.ssn",
      "definitionId": "297d3e23-510a-4a06-9b61-fddebe1bda99",
      "value": "000-00-0292",
      "status": "ACTIVE",
      "sourceType": "INFERRED",
      "confidence": 0.992,
      "evidence": {
        "source": "eval-ingestor-upload",
        "snippet": "000-00-0292",
        "fileName": "002-ssn-card-upload-ocr.txt",
        "sourceMeta": {}
      },
      "createdAt": "2026-06-08T04:43:36.708Z",
      "updatedAt": "2026-06-08T04:43:36.708Z"
    },
    {
      "id": "d63c436c-9569-4b50-8daa-f5b0bfdc8f57",
      "userId": "125c96a5-6b68-431a-8d63-8fa296d7cc7b",
      "locationId": null,
      "slug": "eval.work_authorization.citizenship_status",
      "definitionId": "03317207-51af-4f18-8c9d-8b5d90c40276",
      "value": "An alien authorized to work",
      "status": "ACTIVE",
      "sourceType": "INFERRED",
      "confidence": 0.9,
      "evidence": {
        "source": "eval-ingestor-upload",
        "snippet": "Citizenship/Immigration Status Attestation: An alien authorized to work",
        "fileName": "003-work-authorization-upload-receipt.txt",
        "sourceMeta": {
          "line": 59
        }
      },
      "createdAt": "2026-06-08T04:43:34.638Z",
      "updatedAt": "2026-06-08T04:43:39.923Z"
    },
    {
      "id": "54a56c69-79e3-459f-8045-1b84e483e12e",
      "userId": "125c96a5-6b68-431a-8d63-8fa296d7cc7b",
      "locationId": null,
      "slug": "eval.work_authorization.foreign_passport_number",
      "definitionId": "d0d70dac-fc3e-4ed3-99c5-30fc26e90ac7",
      "value": "XK1234567",
      "status": "ACTIVE",
      "sourceType": "INFERRED",
      "confidence": 1,
      "evidence": {
        "source": "eval-ingestor-upload",
        "snippet": "- Passport No.:    XK1234567",
        "fileName": "003-work-authorization-upload-receipt.txt",
        "sourceMeta": {
          "line": 32
        }
      },
      "createdAt": "2026-06-08T04:43:39.912Z",
      "updatedAt": "2026-06-08T04:43:39.912Z"
    },
    {
      "id": "c7d79774-f0e2-42b3-9367-951137dc7db0",
      "userId": "125c96a5-6b68-431a-8d63-8fa296d7cc7b",
      "locationId": null,
      "slug": "eval.work_authorization.i94_admission_number",
      "definitionId": "a8c2a72a-c4a6-4728-ad80-1ed37efd9e84",
      "value": "11223344556",
      "status": "ACTIVE",
      "sourceType": "INFERRED",
      "confidence": 1,
      "evidence": {
        "source": "eval-ingestor-upload",
        "snippet": "- Admission No.:   11223344556",